<?xml version="1.0"?>
<xs:schema xmlns:xs="http://www.w3.org/2001/XMLSchema">
    <xs:element name="asseguranca_cotxe">
        <xs:complexType>
            <xs:sequence>
                <xs:element name="asseguranca" maxOccurs="unbounded">
                    <xs:complexType>
                        <xs:sequence>
                            <xs:element name="asseguradora" type="xs:string"/>
                            <xs:element name="geocobertura" type="xs:string"/>
                            <xs:element name="cobrament">
                                <xs:complexType>
                                    <xs:sequence>
                                        <xs:element name="financament" type="xs:int"/>
                                        <xs:element name="mensualitat" type="xs:decimal"/>
                                        <xs:element name="mensualitativa" type="xs:decimal"/>
                                        <xs:element name="anual" type="xs:int"/>
                                    </xs:sequence>
                                    <xs:attribute name="en" type="xs:string"/>
                                    <xs:attribute name="mensual" type="xs:string"/>
                                </xs:complexType>
                            </xs:element>
                            <xs:element name="promocions">
                                <xs:complexType>
                                    <xs:sequence>
                                        <xs:element name="descompteonline" type="xs:int" minOccurs="0"/>
                                        <xs:element name="descompteedat" minOccurs="0">
                                            <xs:complexType>
                                                <xs:attribute name="edat" type="xs:int"/>
                                                <xs:attribute name="import" type="xs:int"/>
                                                <xs:attribute name="percentatge" type="xs:int"/>
                                            </xs:complexType>
                                        </xs:element>
                                    </xs:sequence>
                                    <xs:attribute name="nouclient" type="xs:string"/>
                                </xs:complexType>
                            </xs:element>
                        </xs:sequence>
                        <xs:attribute name="id" type="xs:int"/>
                        <xs:attribute name="denominacio" type="xs:string"/>
                    </xs:complexType>
                </xs:element>
            </xs:sequence>
        </xs:complexType>
    </xs:element>
</xs:schema>
